{
  "architecture_id": "fixed-forge-hotspot-8-4-v1",
  "backend_id": "structural-yosys-local-v1",
  "cell_area": null,
  "code_id": "forge-hotspot-8-4-v1",
  "congestion": null,
  "controller_area": null,
  "controller_energy": null,
  "corner": null,
  "corrected_decode_energy": null,
  "critical_path": null,
  "decoder_latency": 0,
  "due_decode_energy": null,
  "encoder_energy": null,
  "encoder_latency": 0,
  "evidence_level": "structural_only",
  "hold_slack": null,
  "implementation_id": "forge-hotspot-8-4-v1-archived-table-decoder",
  "initiation_interval": 1,
  "k": 4,
  "leakage_power": null,
  "library": null,
  "maximum_frequency": null,
  "metadata_bits": 0,
  "mux_area": null,
  "mux_energy": null,
  "n": 8,
  "no_error_decode_energy": null,
  "pdk": null,
  "provenance": {
    "backend_manifest_sha256": "ec6084cc7215a323223624f48db5de2f9909377e26cee3befb1e4338a414fea2",
    "backend_reason": "Yosys generic logic only; no Liberty timing, power, or physical area",
    "code_manifest_sha256": "b292ed394670631ac146200756565d38ce6537c33fa58cd50b0c05fa691f8b00",
    "implementation_manifest_sha256": "3122e8aadc19898a93298e282a73481edabe51b30127a821c2ae0951a5803fd0",
    "matrix_sha256": "49dc2e5537bc0a4c1ab13f59c47c38452508d34711701d108fcf8c7c79ac50af",
    "source_report_hashes": {
      "reports/code_synthesis/code.json": "d0c11ea3c72a60cd0a208865a24c192ad1f90066df0d46e0bcdb2557efeb6873",
      "reports/code_synthesis/verification_report.json": "470efbc5cca5eaec7d4c81eeda12713f408051196fdbd1a9925306bf548ae923"
    },
    "tool_versions": {
      "iverilog": {
        "available": true,
        "path": "D:\\Compiler Cpp\\ucrt64\\bin\\iverilog.EXE",
        "version": "Icarus Verilog version 12.0 (devel) (s20150603-1391-gd480c4d7d)"
      },
      "platform": "Windows-11-10.0.26200-SP0",
      "python": "3.12.5",
      "verilator": {
        "available": true,
        "path": "D:\\Compiler Cpp\\ucrt64\\bin\\verilator",
        "version": "unreadable: [WinError 193] %1 is not a valid Win32 application"
      },
      "yosys": {
        "available": true,
        "path": "D:\\Compiler Cpp\\ucrt64\\bin\\yosys.EXE",
        "version": "Yosys 0.30+48 (git sha1 b5b0b7e83, x86_64-w64-mingw32-g++ 13.1.0 -march=nocona -msahf -mtune=generic -O2 -Os)"
      }
    },
    "verification_sha256": "d853c641f12269fcc9daa25e51ce63ff7dbcc9c363bfe3849c1d28320508b612",
    "verification_status": "passed",
    "workload_sha256": "2a83fa17b9cc2d25eefb034153f5df846ba884688fa5a2f4745d0800a1dee824"
  },
  "redundancy": 4,
  "reencoding_energy": null,
  "result_id": "characterization-8f205bf58d54b4e5fa185350",
  "result_sha256": "9b3a5ad3a4cc890b7b248592c7af8af43b1281cb0ccf2052abe8d7cda4ec0b7a",
  "routed_area": null,
  "schema_version": 1,
  "setup_slack": null,
  "structural_metrics": {
    "available": true,
    "evidence_paths": [
      "reports/safeforge_hardware_validation/nominal_robust_structural_comparison.json"
    ],
    "scope": "technology-independent structural evidence; not physical PPA",
    "tool": "Yosys 0.30+48"
  },
  "technology": null,
  "temperature": null,
  "timing_constraints": null,
  "transition_energy": null,
  "transition_latency": null,
  "uncertainty": null,
  "unsupported_fields": [
    "cell_area",
    "congestion",
    "controller_area",
    "controller_energy",
    "corner",
    "corrected_decode_energy",
    "critical_path",
    "due_decode_energy",
    "encoder_energy",
    "hold_slack",
    "leakage_power",
    "library",
    "maximum_frequency",
    "mux_area",
    "mux_energy",
    "no_error_decode_energy",
    "pdk",
    "reencoding_energy",
    "routed_area",
    "setup_slack",
    "technology",
    "temperature",
    "timing_constraints",
    "transition_energy",
    "transition_latency",
    "uncertainty",
    "voltage",
    "wirelength"
  ],
  "voltage": null,
  "wirelength": null,
  "workload_id": "functional-uniform-placeholder-v1"
}
