{
  "architecture_id": "fixed-shortened-bch-78-64-t2-v1",
  "backend_id": "structural-yosys-local-v1",
  "cell_area": null,
  "code_id": "shortened-bch-78-64-t2-v1",
  "congestion": null,
  "controller_area": null,
  "controller_energy": null,
  "corner": null,
  "corrected_decode_energy": null,
  "critical_path": null,
  "decoder_latency": 0,
  "due_decode_energy": null,
  "encoder_energy": null,
  "encoder_latency": 0,
  "evidence_level": "structural_only",
  "hold_slack": null,
  "implementation_id": "shortened-bch-78-64-t2-v1-reference-decoder",
  "initiation_interval": 1,
  "k": 64,
  "leakage_power": null,
  "library": null,
  "maximum_frequency": null,
  "metadata_bits": 0,
  "mux_area": null,
  "mux_energy": null,
  "n": 78,
  "no_error_decode_energy": null,
  "pdk": null,
  "provenance": {
    "backend_manifest_sha256": "ec6084cc7215a323223624f48db5de2f9909377e26cee3befb1e4338a414fea2",
    "backend_reason": "Yosys generic logic only; no Liberty timing, power, or physical area",
    "code_manifest_sha256": "8b56db993f47e86272cc54d308f7c22a4405b408cee119bbbc1a329c337c54fc",
    "implementation_manifest_sha256": "7c98c8f0000e8fb47ab0a6c0d8692fdbe882be5136215e61ec3d6e5623a79dd3",
    "matrix_sha256": "d518cab40c77da302afecab0e8199f3f0c4e0b2c095660d5d0df8a1e2dae4e89",
    "source_report_hashes": {
      "green_ecc_physical_simulation/evidence/primitive_bch_construction_certificate.json": "1367181ca19fdfd9c3f8eb8ae12f81fe5eb3e86fadec5c2a7820d20625155918"
    },
    "tool_versions": {
      "iverilog": {
        "available": true,
        "path": "D:\\Compiler Cpp\\ucrt64\\bin\\iverilog.EXE",
        "version": "Icarus Verilog version 12.0 (devel) (s20150603-1391-gd480c4d7d)"
      },
      "platform": "Windows-11-10.0.26200-SP0",
      "python": "3.12.5",
      "verilator": {
        "available": true,
        "path": "D:\\Compiler Cpp\\ucrt64\\bin\\verilator",
        "version": "unreadable: [WinError 193] %1 is not a valid Win32 application"
      },
      "yosys": {
        "available": true,
        "path": "D:\\Compiler Cpp\\ucrt64\\bin\\yosys.EXE",
        "version": "Yosys 0.30+48 (git sha1 b5b0b7e83, x86_64-w64-mingw32-g++ 13.1.0 -march=nocona -msahf -mtune=generic -O2 -Os)"
      }
    },
    "verification_sha256": "0d18683b2a0e428057430e025acc9de821acc88f008995b1e1e82d203186ef67",
    "verification_status": "passed",
    "workload_sha256": "f52002acbda1034446521ccfc5463461a42cf0c498a89900ee37f36eb1e2fcb7"
  },
  "redundancy": 14,
  "reencoding_energy": null,
  "result_id": "characterization-54ea85b1530ab075c36ec731",
  "result_sha256": "2af87ce40e6a2e5a7dec90518af38a12aa5916abe1db44471e90f4692c8ef679",
  "routed_area": null,
  "schema_version": 1,
  "setup_slack": null,
  "structural_metrics": {
    "available": true,
    "evidence_paths": [
      "reports/safeforge_hardware_validation/nominal_robust_structural_comparison.json"
    ],
    "scope": "technology-independent structural evidence; not physical PPA",
    "tool": "Yosys 0.30+48"
  },
  "technology": null,
  "temperature": null,
  "timing_constraints": null,
  "transition_energy": null,
  "transition_latency": null,
  "uncertainty": null,
  "unsupported_fields": [
    "cell_area",
    "congestion",
    "controller_area",
    "controller_energy",
    "corner",
    "corrected_decode_energy",
    "critical_path",
    "due_decode_energy",
    "encoder_energy",
    "hold_slack",
    "leakage_power",
    "library",
    "maximum_frequency",
    "mux_area",
    "mux_energy",
    "no_error_decode_energy",
    "pdk",
    "reencoding_energy",
    "routed_area",
    "setup_slack",
    "technology",
    "temperature",
    "timing_constraints",
    "transition_energy",
    "transition_latency",
    "uncertainty",
    "voltage",
    "wirelength"
  ],
  "voltage": null,
  "wirelength": null,
  "workload_id": "functional-uniform-placeholder-v1"
}
